category_id,category_name,description,picture
1,Beverages,"Soft drinks, coffees, teas, beers, and ales",<memory at 0x7f20f942ebb0>
2,Condiments,"Sweet and savory sauces, relishes, spreads, and seasonings",<memory at 0x7f20f942ee20>
3,Confections,"Desserts, candies, and sweet breads",<memory at 0x7f20f942eef0>
4,Dairy Products,Cheeses,<memory at 0x7f20f9385050>
5,Grains/Cereals,"Breads, crackers, pasta, and cereal",<memory at 0x7f20f9385120>
6,Meat/Poultry,Prepared meats,<memory at 0x7f20f93851f0>
7,Produce,Dried fruit and bean curd,<memory at 0x7f20f93852c0>
8,Seafood,Seaweed and fish,<memory at 0x7f20f9385390>
